key,Transition text,Question ,Choices,Context,theme,choice type901,Let's talk together to select something to eat,Do you like meat?,id1-Yes:id2-No,demo,simple,yesno902,Sorry to hear that!,Do you like fish?,id1-Yes:id2-No,demo,simple,yesno903,,Do you like the smell of barbecue?,id1-Yes:id2-No,demo,simple,yesno904,We will prepare some baby back ribs!,Is it OK?,id1-ok,demo,simple,ok905,We will prepare some  beef Kung Pao!,Is it OK?,id1-ok,demo,simple,ok906,,Do you like spicy sauce?,id1-Yes:id2-No,demo,simple,yesno907,We will prepare some szechuan shrimps!,Is it OK?,id1-ok,demo,simple,ok908,We will prepare some Lemon fish!,Is it OK?,id1-ok,demo,simple,ok909,We will prepare a Club Sandwich!,Is it OK?,id1-ok,demo,simple,ok